{
  "$schema": "./sketch-thru-plan-validations.schema.json",
  "title": "Sketch-thru-Plan call validations",
  "description": "Data-driven checks a client runs around a state-changing STP call (STP-1064): before the call, the preconditions, the params the engine silently ignores a call without, and the poids that must name existing objects; after the call, the events that prove it did what it asked (intent). Every write and destructive method of the contract has an entry. See README.md, 'Call validations'.",
  "version": "1.0.8",
  "contractVersion": "0.9.9",
  "refusalMessage": {
    "event": "StpMessage",
    "contains": "'{method}'"
  },
  "methods": {
    "SendPenDown": {
      "preconditions": [
        "activeScenario"
      ],
      "required": [
        "location"
      ],
      "intent": {
        "expect": []
      }
    },
    "SendInk": {
      "preconditions": [
        "activeScenario"
      ],
      "required": [
        "strokePoints"
      ],
      "intent": {
        "expect": []
      }
    },
    "SendSpeechRecognition": {
      "preconditions": [
        "activeScenario"
      ],
      "required": [
        "recoList"
      ],
      "intent": {
        "expect": [
          {
            "event": "SpeechParsed"
          }
        ]
      }
    },
    "SendSimulatedSpeechRecognition": {
      "preconditions": [
        "activeScenario"
      ],
      "required": [
        "text"
      ],
      "intent": {
        "expect": [
          {
            "event": "SpeechParsed"
          }
        ]
      }
    },
    "CreateNewScenario": {
      "preconditions": [],
      "intent": {
        "expect": []
      },
      "confirm": "Replaces the session's current scenario, and every object in it, with a new empty scenario named {name}."
    },
    "LoadNewScenario": {
      "preconditions": [],
      "intent": {
        "expect": []
      },
      "confirm": "Replaces the session's current scenario, and every object in it, with the scenario in the content."
    },
    "ImportPlanData": {
      "preconditions": [
        "activeScenario"
      ],
      "intent": {
        "expect": []
      },
      "confirm": "Imports the content into the current scenario; an imported object REPLACES a resident one with the same poid."
    },
    "SyncScenarioSession": {
      "preconditions": [
        "activeScenario"
      ],
      "intent": {
        "expect": []
      },
      "confirm": "Merges the content into the current scenario; an object in the content REPLACES a resident one with the same poid."
    },
    "AddSymbol": {
      "preconditions": [
        "activeScenario"
      ],
      "required": [
        "symbol"
      ],
      "references": [
        {
          "param": "symbol.parentCoa",
          "kind": "coa"
        }
      ],
      "intent": {
        "expect": [
          {
            "event": "SymbolAdded",
            "match": {
              "alternates.0.fsTYPE": {
                "param": "symbol.fsTYPE"
              },
              "alternates.0.designator1": {
                "param": "symbol.designator1"
              }
            }
          }
        ],
        "acks": [
          "InkProcessed"
        ]
      }
    },
    "UpdateSymbol": {
      "preconditions": [
        "activeScenario"
      ],
      "required": [
        "symbol"
      ],
      "references": [
        {
          "param": "poid",
          "kind": "symbol",
          "required": true
        },
        {
          "param": "symbol.parentCoa",
          "kind": "coa"
        }
      ],
      "intent": {
        "expect": [
          {
            "event": "SymbolModified",
            "match": {
              "poid": {
                "param": "poid"
              }
            }
          }
        ],
        "other": [
          {
            "event": "SymbolDeleted",
            "match": {
              "poid": {
                "param": "poid"
              }
            }
          }
        ],
        "acks": [
          "InkProcessed"
        ]
      }
    },
    "DeleteSymbol": {
      "preconditions": [
        "activeScenario"
      ],
      "references": [
        {
          "param": "poid",
          "kind": "symbol",
          "required": true
        }
      ],
      "intent": {
        "expect": [
          {
            "event": "SymbolDeleted",
            "match": {
              "poid": {
                "param": "poid"
              }
            }
          }
        ],
        "other": [
          {
            "event": "SymbolModified",
            "match": {
              "poid": {
                "param": "poid"
              }
            }
          }
        ]
      },
      "confirm": "Deletes the symbol {poid} from the scenario."
    },
    "ChooseAlternate": {
      "preconditions": [
        "activeScenario"
      ],
      "references": [
        {
          "param": "poid",
          "kind": [
            "symbol",
            "task"
          ],
          "required": true
        }
      ],
      "intent": {
        "expect": []
      }
    },
    "ImportTaskOrgContent": {
      "preconditions": [
        "activeScenario"
      ],
      "intent": {
        "expect": []
      },
      "confirm": "Imports task org content; an imported object REPLACES a resident one with the same poid."
    },
    "SetDefaultTaskOrg": {
      "preconditions": [
        "activeScenario"
      ],
      "references": [
        {
          "param": "poid",
          "kind": "taskOrg",
          "required": true
        }
      ],
      "intent": {
        "expect": []
      }
    },
    "ResetDefaultTaskOrg": {
      "preconditions": [
        "activeScenario"
      ],
      "intent": {
        "expect": []
      }
    },
    "AddTaskOrg": {
      "preconditions": [
        "activeScenario"
      ],
      "required": [
        "taskOrg"
      ],
      "intent": {
        "expect": [
          {
            "event": "TaskOrgAdded",
            "match": {
              "taskOrg.name": {
                "param": "taskOrg.name"
              }
            }
          }
        ],
        "other": [
          {
            "event": "TaskOrgModified",
            "match": {
              "taskOrg.name": {
                "param": "taskOrg.name"
              }
            }
          }
        ]
      }
    },
    "UpdateTaskOrg": {
      "preconditions": [
        "activeScenario"
      ],
      "required": [
        "taskOrg"
      ],
      "references": [
        {
          "param": "poid",
          "kind": "taskOrg",
          "required": true
        }
      ],
      "intent": {
        "expect": [
          {
            "event": "TaskOrgModified",
            "match": {
              "poid": {
                "param": "poid"
              }
            }
          }
        ],
        "other": [
          {
            "event": "TaskOrgDeleted",
            "match": {
              "poid": {
                "param": "poid"
              }
            }
          }
        ]
      }
    },
    "DeleteTaskOrg": {
      "preconditions": [
        "activeScenario"
      ],
      "references": [
        {
          "param": "poid",
          "kind": "taskOrg",
          "required": true
        }
      ],
      "intent": {
        "expect": [
          {
            "event": "TaskOrgDeleted",
            "match": {
              "poid": {
                "param": "poid"
              }
            }
          }
        ]
      },
      "confirm": "Deletes the task org {poid}."
    },
    "AddTaskOrgUnit": {
      "preconditions": [
        "activeScenario"
      ],
      "required": [
        "toUnit"
      ],
      "references": [
        {
          "param": "toUnit.parentTO",
          "kind": "taskOrg"
        }
      ],
      "intent": {
        "expect": [
          {
            "event": "TaskOrgUnitAdded",
            "match": {
              "toUnit.name": {
                "param": "toUnit.name"
              }
            }
          }
        ],
        "other": [
          {
            "event": "TaskOrgUnitModified",
            "match": {
              "toUnit.name": {
                "param": "toUnit.name"
              }
            }
          }
        ]
      }
    },
    "UpdateTaskOrgUnit": {
      "preconditions": [
        "activeScenario"
      ],
      "required": [
        "toUnit"
      ],
      "references": [
        {
          "param": "poid",
          "kind": "taskOrgUnit",
          "required": true
        },
        {
          "param": "toUnit.parentTO",
          "kind": "taskOrg"
        }
      ],
      "intent": {
        "expect": [
          {
            "event": "TaskOrgUnitModified",
            "match": {
              "poid": {
                "param": "poid"
              }
            }
          }
        ],
        "other": [
          {
            "event": "TaskOrgUnitDeleted",
            "match": {
              "poid": {
                "param": "poid"
              }
            }
          }
        ]
      }
    },
    "DeleteTaskOrgUnit": {
      "preconditions": [
        "activeScenario"
      ],
      "references": [
        {
          "param": "poid",
          "kind": "taskOrgUnit",
          "required": true
        }
      ],
      "intent": {
        "expect": [
          {
            "event": "TaskOrgUnitDeleted",
            "match": {
              "poid": {
                "param": "poid"
              }
            }
          }
        ]
      },
      "confirm": "Deletes the task org unit {poid}."
    },
    "AddTaskOrgRelationship": {
      "preconditions": [
        "activeScenario"
      ],
      "required": [
        "toRelationship"
      ],
      "references": [
        {
          "param": "toRelationship.parent",
          "kind": "taskOrgUnit"
        },
        {
          "param": "toRelationship.child",
          "kind": "taskOrgUnit"
        },
        {
          "param": "toRelationship.parentTO",